200,a,"""not the best song from this album"" have the album saved as I generally like the artist. lively, upbeat, pop-punk genre is quite nostalgic to me. not really with this song, moreso the artist as my friends have similar music taste so listening to this makes me think of them more than anything.", have the album saved as I generally like the artist.,,not the best song from this album ,,," lively, upbeat, pop-punk genre is quite nostalgic to me",,,," lively, upbeat, pop-punk genre is quite nostalgic to me",,,,,,,,,,,,,not the best song from this album /  have the album saved as I generally like the artist.," have the album saved as I generally like the artist. / . not really with this song, moreso the artist as my friends have similar music taste so listening to this makes me think of them more than anything.",," lively, upbeat, pop-punk genre is quite nostalgic to me",,,,,,,,,,,,,,,,,," lively, upbeat, pop-punk genre is quite nostalgic to me",,,,,". not really with this song, moreso the artist as my friends have similar music taste so listening to this makes me think of them more than anything.",,,,,,,,,,,,,,,,,,,,,,,,,,". not really with this song, moreso the artist as my friends have similar music taste so listening to this makes me think of them more than anything.",
200,b,"""this is too sad for my current mood at the moment, so should probably skip it"" I do like this song as it's quite mellow and meaningful, and must have really felt in the mood to listen to it when i saved it. it's calm and acoustic sounding, and that's generally the sort of sound I go for. not really, I like the sound of the song and the lyrics but can't relate to them personally.",,,,,," I do like this song as it's quite mellow and meaningful, and must have really felt in the mood to listen to it when i saved it. "," not really, I like the sound of the song and the lyrics but can't relate to them personally."," I do like this song as it's quite mellow and meaningful, and must have really felt in the mood to listen to it when i saved it. ",,,,,,,,,,," it's calm and acoustic sounding, and that's generally the sort of sound I go for/  not really, I like the sound of the song and the lyrics but can't relate to them personally.",,,,,,,,,,,,,,,,,,,,,,,,,,,,,,,,,,,,,,,,,,,,,,,,,," it's calm and acoustic sounding, and that's generally the sort of sound I go for",,,,,"""this is too sad for my current mood at the moment, so should probably skip it""/  I do like this song as it's quite mellow and meaningful, and must have really felt in the mood to listen to it when i saved it. "," not really, I like the sound of the song and the lyrics but can't relate to them personally.",
201,a,Dancing  It's catchy  Because it's a fun and catchy song  Yes because it reminds me of fun times with my friends ,,,,,, It's catchy  Because it's a fun and catchy song,,,,, It's catchy  Because it's a fun and catchy song,,,,,,,,,,,,,,,,,,,,,,,,,,,,,,,,,,,,,, it reminds me of fun times with my friends ,,, Yes because it reminds me of fun times with my friends ,,Dancing,,,,,,,,,,,,,,,,,,,,,,
201,b,A concert I went to  This song is by an artist I really like It has a good music beat to dance to  Yes because it reminds me of the concert I went to by this artist which brings back good memories ,This song is by an artist I really like,,,,,,,,, It has a good music beat to dance to ,,,,,,,,,,,,,,This song is by an artist I really like/ Yes because it reminds me of the concert I went to by this artist which brings back good memories ,,,,,,,,,,,,Yes because it reminds me of the concert I went to by this artist which brings back good memories ,A concert I went to / Yes because it reminds me of the concert I went to by this artist which brings back good memories ,,,,,,,,,,,,,,,,, It has a good music beat to dance to ,,,,,,,,,,,,,,,,,,,,,,
202,a,"Memories of my childhood. I use to listen to this artist, and in particular this album, with my brothers. /This is one of my favorite artists. I love the way they develop melody and pace. As a synesthete the ""light show"" is pleasant and not too distracting to listen to when doing other tasks. This song also brings back good memories and the message is a good one. /The instrumentation, melodies, and use of voice are pleasant to listen to. /Yes. See previous responses","This song also brings back good memories and the message is a good one. / The instrumentation, melodies, and use of voice are pleasant to listen to.",This is one of my favorite artists. ,,,,,,This song also brings back good memories and the message is a good one.,,,,"The instrumentation, melodies, and use of voice are pleasant to listen to.",". I love the way they develop melody and pace.  / The instrumentation, melodies, and use of voice are pleasant to listen to.","The instrumentation, melodies, and use of voice are pleasant to listen to.",,,,. I love the way they develop melody and pace. ," As a synesthete the ""light show"" is pleasant and not too distracting to listen to when doing other tasks",,,"The instrumentation, melodies, and use of voice are pleasant to listen to."," I use to listen to this artist, and in particular this album, with my brothers. "," I use to listen to this artist, and in particular this album, with my brothers. / This is one of my favorite artists. ",,,,,,,,,,This song also brings back good memories and the message is a good one.,,This song also brings back good memories and the message is a good one.,,,,,Memories of my childhood. ,,,,,,," I use to listen to this artist, and in particular this album, with my brothers. ",,,,,,,,,,,,," As a synesthete the ""light show"" is pleasant and not too distracting to listen to when doing other tasks",,,,,,,,,,,,,,,
202,b,"A mellow ""light show"". It evokes feelings of sadness and appreciation for the music at the same time as well. \I love the Eagles. It was part of the greatest hits album. Their music makes me think of my dad. More recently, their music evokes good memories having to do with my boyfriend as well. \It depends on my mood and what I am doing. Sometimes I very much enjoy it for the music, piano work, the use of voice, and the colors that come up when I listen to this track. Other times the sadness is too strong and I cannot listen to it. \I have a relationship with the artist more than the track.",\I love the Eagles.,,,,,,," It evokes feelings of sadness and appreciation for the music at the same time as well./ Sometimes I very much enjoy it for the music, piano work, the use of voice, and the colors that come up when I listen to this track.",,,,"Sometimes I very much enjoy it for the music, piano work, the use of voice, and the colors that come up when I listen to this track.",,,,,,,"Sometimes I very much enjoy it for the music, piano work, the use of voice, and the colors that come up when I listen to this track.",,,"Sometimes I very much enjoy it for the music, piano work, the use of voice, and the colors that come up when I listen to this track.", It was part of the greatest hits album.,\I love the Eagles./ \I have a relationship with the artist more than the track.,,,,,,,,,,,,"More recently, their music evokes good memories having to do with my boyfriend as well.",,,,,,,,,,,, Their music makes me think of my dad.,,,"More recently, their music evokes good memories having to do with my boyfriend as well.",,,,,,,,,,,"A mellow ""light show"".",,,,,,,,,,, It evokes feelings of sadness and appreciation for the music at the same time as well./ Other times the sadness is too strong and I cannot listen to it. \I,It depends on my mood and what I am doing. ,\I have a relationship with the artist more than the track.,
203,a,going to the beach Because it is a great song Because it is relaxing and somehow it calms me No,Because it is a great song ,,,,,,,,,,,,,,,,,,,,,,,,,,,,,,,,,,,,,,,going to the beach,,,,,,,,,,,,,,,,,,,,,,,,,,,,,Because it is relaxing and somehow it calms me,,,,,,No,
203,b,Going back home This is the one of the few singles my favourite artist released The music is so uplifting and it reminds me of home No,,This is the one of the few singles my favourite artist released ,,,,The music is so uplifting and it reminds me of home ,,,,,,,,,,,,,,,,,,This is the one of the few singles my favourite artist released ,,,,,,,,,,,,,,,,Going back home / The music is so uplifting and it reminds me of home,,,,,,,,,,,,,,,,,,,,,,,,,,,The music is so uplifting and it reminds me of home,,,,,,,,No,
204,a,"My Boyfriend/It makes me smile and puts me in a good mood when it comes on, reminds me of my boyfriend when he's away from me. /I love the words and what is being said, I imagine that it would be a great first dance at a wedding. Makes me think of happy times that lie ahead and helps me to escape the stress of third year!/Not really, just really like it as it makes me happy.","/I love the words and what is being said, I imagine that it would be a great first dance at a wedding. / Not really, just really like it as it makes me happy.",,,,,,"/I love the words and what is being said, I imagine that it would be a great first dance at a wedding. ","/I love the words and what is being said, I imagine that it would be a great first dance at a wedding. ",,,,,,,,,,,,,,,,,,,,,,,,,,,,,,,,,escape the stress of third year!,,,,,,,,,,"My Boyfriend/ It makes me smile and puts me in a good mood when it comes on, reminds me of my boyfriend when he's away from me. ",,,,,,,,,,,I imagine that it would be a first dance at a wedding ,,,,,"It makes me smile and puts me in a good mood when it comes on, reminds me of my boyfriend when he's away from me. ",Makes me think of happy times that lie ahead and helps me to escape the stress of third year!/,,,"It makes me smile and puts me in a good mood when it comes on, reminds me of my boyfriend when he's away from me.  / Not really, just really like it as it makes me happy.",,,,"Not really, just really like it as it makes me happy.",
204,b,"Ed Sheeran \Its got a god beat and soo glad to have new music being released from Ed Sheeran again!\Good beat and easy to sing along to, easy listening in the car or when walking somewhere. \No, not really just like the song as its good in my opinion","No, not really just like the song as its good in my opinion",,,,,,,,,"Its got a god beat and soo glad to have new music being released from Ed Sheeran again!/ Good beat and easy to sing along to, easy listening in the car or when walking somewhere.",,,,,,,,,,,,,,Ed Sheeran/ Its got a god beat and soo glad to have new music being released from Ed Sheeran again!,,,,,,,,,,,,,,,,,,,,,,,,,,,,,,,"Good beat and easy to sing along to, easy listening in the car or when walking somewhere.",,,"Good beat and easy to sing along to, easy listening in the car or when walking somewhere.",,"Good beat and easy to sing along to, easy listening in the car or when walking somewhere.",,,,,,,,,,,,,,,"No, not really just like the song as its good in my opinion",
205,a,"It's on the soundtrack to the film ""Juno"". As part of the above soundtrack - it's an album I really enjoy listening to.  It's a relaxing track, quite simple and lo-fi. The music is simple - chords strummed on an instrument, and the lyrics/message is very simple and timeless. Not especially - I would generally only listen to it as part of the soundtrack it's on, unlike other songs on the same album which I would actively choose to playlist or play on their own. That said, it is instantly recognisable.", As part of the above soundtrack - it's an album I really enjoy listening to.  ,,," Not especially - I would generally only listen to it as part of the soundtrack it's on, unlike other songs on the same album which I would actively choose to playlist or play on their own. That said, it is instantly recognisable.",,,"The music is simple - chords strummed on an instrument, and the lyrics",message is very simple and timeless.,,,,"The music is simple - chords strummed on an instrument, and the lyrics",,,,,,," It's a relaxing track, quite simple and lo-fi. / The music is simple - chords strummed on an instrument, and the lyrics /  That said, it is instantly recognisable.",,,," As part of the above soundtrack - it's an album I really enjoy listening to.  /  Not especially - I would generally only listen to it as part of the soundtrack it's on, unlike other songs on the same album which I would actively choose to playlist or play on their own. That said, it is instantly recognisable.",,,,,,"It's on the soundtrack to the film ""Juno"". /  As part of the above soundtrack - it's an album I really enjoy listening to.  ",,," Not especially - I would generally only listen to it as part of the soundtrack it's on, unlike other songs on the same album which I would actively choose to playlist or play on their own. That said, it is instantly recognisable.",,,,,,,,,,,,,,,,,,,,,,,,,,,,,,,,,,,,," It's a relaxing track, quite simple and lo-fi.",,,,,," Not especially - I would generally only listen to it as part of the soundtrack it's on, unlike other songs on the same album which I would actively choose to playlist or play on their own. That said, it is instantly recognisable.",
205,b,"It makes me think of Galicia, Spain and my year as an Erasmus student. It's part of a ""best of"" compilation of this band. They're a famous Gallego folk band, one of the best known. They headlined a celtic music festival I went to in Galicia last summer, so I downloaded this album to remind myself of what they sounded like. It's not really so much my thing - undoubtedly they're a very accomplished band but this track has a very fado influenced style, which I liked at one time but not so much now. I prefer their more celtic sounding stuff. 

 No, I don't knwo this one particularly. But hearing the music and the Gallego language does make me think of last summer, and of my experiences living there over ten years ago.", I prefer their more celtic sounding stuff. ,,"It's not really so much my thing - undoubtedly they're a very accomplished band but this track has a very fado influenced style, which I liked at one time but not so much now",,"No, I don't knwo this one particularly.",,,,,,,,,,,,,,,"It's not really so much my thing - undoubtedly they're a very accomplished band but this track has a very fado influenced style, which I liked at one time but not so much now",,," It's part of a ""best of"" compilation of this band. /  They headlined a celtic music festival I went to in Galicia last summer, so I downloaded this album to remind myself of what they sounded like."," It's part of a ""best of"" compilation of this band. / They're a famous Gallego folk band, one of the best known/ It's not really so much my thing - undoubtedly they're a very accomplished band but this track has a very fado influenced style, which I liked at one time but not so much now",,"They're a famous Gallego folk band, one of the best known",,,,,,,,,,,"They headlined a celtic music festival I went to in Galicia last summer, so I downloaded this album to remind myself of what they sounded like.",,,"It makes me think of Galicia, Spain and my year as an Erasmus student./  But hearing the music and the Gallego language does make me think of last summer, and of my experiences living there over ten years ago.","It makes me think of Galicia, Spain and my year as an Erasmus student./  But hearing the music and the Gallego language does make me think of last summer, and of my experiences living there over ten years ago.",,,,,,,,,,,,,,,,,,,,,,,," But hearing the music and the Gallego language does make me think of last summer, and of my experiences living there over ten years ago.",,,,,,,,,,"No, I don't knwo this one particularly.",
206,a,"Love this song. One of my favourites. Love to sing along in my car. It's a great tune and is emotive. From one of my favourite musicals No, other than it being from one of my favourite musicals.",Love this song. One of my favourites. Love to sing along in my car /  It's a great tune and is emotive.,"Love this song. One of my favourites. Love to sing along in my car / From one of my favourite musicals / No, other than it being from one of my favourite musicals.",,,,It's a great tune and is emotive.,,,,,,,,,,,,,,,,,,,,,,,,,"From one of my favourite musicals / No, other than it being from one of my favourite musicals.",,,,,,,,,,,,,,,,,,,,,,,,Love this song. One of my favourites. Love to sing along in my car,,,Love this song. One of my favourites. Love to sing along in my car,,,,,,,,, It's a great tune and is emotive.,,,,,,,,"No, other than it being from one of my favourite musicals.",
206,b,"It makes me laugh.  Saved full album when making collection for a friend. Fun song, reminds me of watching the film. No",,,,,,"Fun song, reminds me of watching the film",,,,,,,,,,,,,,,,,Saved full album when making collection for a friend. ,,,,,,"Fun song, reminds me of watching the film.",,,,,,,,,,,,,,,,,,,,Saved full album when making collection for a friend. ,,,,,,,,,,,,,,,,,"Fun song, reminds me of watching the film.",It makes me laugh.  ,,,,,,,,No,
207,a,"Summer and feeling chilled I liked the song when I heard it on the radio Enjoy the fact I can sing along No, I just listen to it", I liked the song when I heard it on the radio / Enjoy the fact I can sing along,,,,,,,,,,,,,,,,,,,,,,,,,,,,,,,,,, I liked the song when I heard it on the radio ,Summer and feeling chilled ,,,,,,,,,,,,,,,,,,,,,,Enjoy the fact I can sing along,,,,,,,Summer and feeling chilled ,,,,,,,,,,"No, I just listen to it",
207,b,Emotional I liked it It's got a proper meaning behind the words Kind of - Louis Tomlinson wrote it for his mom when she was dying of cancer and it makes me think about how my boyfriend may feel and how he may relate to it as his mom passed away from cancer under a year ago, I liked it,,,,,Emotional ,Emotional I liked it It's got a proper meaning behind the words,Emotional I liked it It's got a proper meaning behind the words/  Kind of - Louis Tomlinson wrote it for his mom when she was dying of cancer and it makes me think about how my boyfriend may feel and how he may relate to it as his mom passed away from cancer under a year ago,,,,,,,,,,,,,,,,Louis Tomlinson wrote it for his mom when she was dying of cancer and it makes me think about how my boyfriend may feel and how he may relate to it as his mom passed away from cancer under a year ago,,,,,,,,,,,,,,,,,,,,,,,,,,, Kind of - Louis Tomlinson wrote it for his mom when she was dying of cancer and it makes me think about how my boyfriend may feel and how he may relate to it as his mom passed away from cancer under a year ago,,,,,,,,,,,,,,,,,,,,,,,, Kind of - Louis Tomlinson wrote it for his mom when she was dying of cancer and it makes me think about how my boyfriend may feel and how he may relate to it as his mom passed away from cancer under a year ago,
208,a,"Andrei Tarkovsky's images. I like the band! Also, I made a list with easy-listening, downtempo songs, so I had to include this one. I like the melody of the vocals and the atmosphere the band creates in this one. I usually quote the forst lines for my girlfriend:
""You are my most special island
So famous for your flowers""", I like the band!,,,,,,"I usually quote the forst lines for my girlfriend:""You are my most special island
So famous for your flowers""",,,,,,I like the melody of the vocals and the atmosphere the band creates in this one. ,,,,,,,,"Also, I made a list with easy-listening, downtempo songs, so I had to include this one. ",I like the melody of the vocals and the atmosphere the band creates in this one. ,, I like the band! / I like the melody of the vocals and the atmosphere the band creates in this one. ,,,,Andrei Tarkovsky's images.,,,,"Also, I made a list with easy-listening, downtempo songs, so I had to include this one. ",,,,,,,,,,,,,,,,,,, I usually quote the forst lines for my girlfriend:,,,,,,,,,,,,,,,I like the melody of the vocals and the atmosphere the band creates in this one. ,,,,,,,,,,
208,b,"Jean Baudrillard's ""Saint Clment"" (1987) photograph.  It is one of my favourite Radiohead songs. I like eveything about it. For its lyrics and the mesmerizing soundscapes. ""I'm not here, this isn't happening""
Best song for those days that you feel that you carry the weight of the world. ",I like eveything about it., It is one of my favourite Radiohead songs.,,,,,"For its lyrics and the mesmerizing soundscapes./ ""I'm not here, this isn't happening""",,,,,,,,,,,For its lyrics and the mesmerizing soundscapes.,For its lyrics and the mesmerizing soundscapes.,,,,, It is one of my favourite Radiohead songs.,,,,"Jean Baudrillard's ""Saint Clment"" (1987) photograph",,,,,,,,,,,,,,,,,,,,,,,,,,,,,,,,,,,,,,,,,,,,,,Best song for those days that you feel that you carry the weight of the world. ,,
209,a,Funny song from when I was young To play as a joke  It's not a serious song and not something I would choose to listen to  No,,, To play as a joke  It's not a serious song and not something I would choose to listen to,,,"Funny song from when I was young,  To play as a joke  It's not a serious song and not something I would choose to listen to",, To play as a joke  It's not a serious song and not something I would choose to listen to,,,,,,,,,,,,,,,,,,,,,,,,,,,,,,,,,Funny song from when I was young,,,,,,,,,,,,,,,,,,,,,,,,,,,,,,,,,,No,
209,b,Lock Stock and 2 smoking barrels opening scene I like OCS  I particularly like Guitarist Steve Craddocks style Not really ,I like OCS,,,,,,,,,,, I particularly like Guitarist Steve Craddocks style,, I particularly like Guitarist Steve Craddocks style,,,,,, I particularly like Guitarist Steve Craddocks style,,,,I like OCS,,,,,Lock Stock and 2 smoking barrels opening scene,,,,,,,,,,,,,,,,,,,,,,,,,,,,,,,,,,,,,,,,,,,,,, Not really ,
210,a,"It makes me remember being about 11 years old, and the friends I had then It's high energy and makes me feel happy It's a good song that leaves me full of energy (even if I might not admit to having it on there normally...) No", It's a good song that leaves me full of energy (even if I might not admit to having it on there normally...) ,, It's a good song that leaves me full of energy (even if I might not admit to having it on there normally...) ,,, It's high energy and makes me feel happy,,,,,,,,,,,,,,,,,,,,,,,,,,,,,,,,,,,"It makes me remember being about 11 years old, and the friends I had then",,,,,,,,"It makes me remember being about 11 years old, and the friends I had then",,,,,,,,,,,,,,,,,,,,, It's high energy and makes me feel happy /  It's a good song that leaves me full of energy (even if I might not admit to having it on there normally...) , It's high energy and makes me feel happy,,,,No,
210,b,"This song remind me of being around 16 It's another fun song that gives me a lift when I hear it It's a fun, upbeat song. No particular relationship, I liked the band when I was younger, but maybe prefer other songs by them",,,,,,,,,,"It's a fun, upbeat song. ",,,,,,,,,,,,,,"No particular relationship, I liked the band when I was younger, but maybe prefer other songs by them",,,,,,,,,,,,,,,,,"This song remind me of being around 16/ No particular relationship, I liked the band when I was younger, but maybe prefer other songs by them",,,,,,,,,,,,,,,,,,,,,,,,,"It's another fun song that gives me a lift when I hear it / It's a fun, upbeat song. ",It's another fun song that gives me a lift when I hear it I,,,,,,,,"No particular relationship, I liked the band when I was younger, but maybe prefer other songs by them",
211,a,"That it is clearly a Sheeran song and you can tell from the first note. I really liked the song and added it to the playlist I most commonly listen to I really love Ed Sheeran's style its both chill and upbeat and that appeals to me Yes I remember being shown this song in the back seat of my friend's car, I hadn't known he had released his new music and we both listened to it the first time then and really enjoyed it","I really liked the song and added it to the playlist I most commonly listen to /  I really love Ed Sheeran's style its both chill and upbeat and that appeals to me / Yes I remember being shown this song in the back seat of my friend's car, I hadn't known he had released his new music and we both listened to it the first time then and really enjoyed it",,,,,I really love Ed Sheeran's style its both chill and upbeat and that appeals to me,,,, I really love Ed Sheeran's style its both chill and upbeat and that appeals to me,,,,,,,,,,That it is clearly a Sheeran song and you can tell from the first note. /  I really love Ed Sheeran's style its both chill and upbeat and that appeals to me,,,,That it is clearly a Sheeran song and you can tell from the first note./  I really love Ed Sheeran's style its both chill and upbeat and that appeals to me,,,,,,,,I really liked the song and added it to the playlist I most commonly listen to ,,,"Yes I remember being shown this song in the back seat of my friend's car, I hadn't known he had released his new music and we both listened to it the first time then and really enjoyed it",,,,,,,,,,,,,,"Yes I remember being shown this song in the back seat of my friend's car, I hadn't known he had released his new music and we both listened to it the first time then and really enjoyed it",,,,,,"Yes I remember being shown this song in the back seat of my friend's car, I hadn't known he had released his new music and we both listened to it the first time then and really enjoyed it",,,,,,,,,,,,,,,,,,,,,
