302,b,"A nice example of future bass music I wanted to get into producing some future bass. I listened to a number of well-subscribed playlists and highlighted tracks from those that I particularly enjoyed. This was one. I enjoy the timbres and composition, particularly the rhythmic elements. Not really. It is really just 'music for research' that I particularly enjoy.",,,,,,,,,,,,,,,,". I enjoy the timbres and composition, particularly the rhythmic elements. ",,". I enjoy the timbres and composition, particularly the rhythmic elements. ",". I enjoy the timbres and composition, particularly the rhythmic elements. ",,,,,,,A nice example of future bass music  I wanted to get into producing some future bass.,,,,,,I listened to a number of well-subscribed playlists and highlighted tracks from those that I particularly enjoyed,,,,,,,,,,,,,,,,,,,,,,,,,,,,,,,,,,,,,,,,,,,Not really. It is really just 'music for research' that I particularly enjoy.,
303,a,Lyrics and melody  I love the band I like the melody and lyrics Yes it's one of many maximo park tracks I enjoy listening too , I love the band I like the melody and lyrics /  Yes it's one of many maximo park tracks I enjoy listening too ,,,,,,Lyrics and melody /  I love the band I like the melody and lyrics ,,,,,,Lyrics and melody /  I love the band I like the melody and lyrics ,,,,,,,,,,, I love the band I like the melody and lyrics /  Yes it's one of many maximo park tracks I enjoy listening too ,,,,,,,,,,,,,,,,,,,,,,,,,,,,,,,,,,,,,,,,,,,,,,,,,,,,
303,b,Dreamy  I know the artist and find his tracks calying and soothing  It relaxes and calms me  Yes it reminds me of a friend and university days spent lounging in pubs and people's houses ,,,,,,Dreamy ,,,,,,,,,,,,,,,,,, I know the artist and find his tracks calying and soothing,,,,,,,,,,,,,,,, Yes it reminds me of a friend and university days spent lounging in pubs and people's houses , Yes it reminds me of a friend and university days spent lounging in pubs and people's houses ,,,,,,,, Yes it reminds me of a friend and university days spent lounging in pubs and people's houses ,,,,,,,,,,,,,,,,,,,, I know the artist and find his tracks calying and soothing/   It relaxes and calms me ,,,,,,,
304,a,"Racial division I like the singers voice, the band, and the song The singer, the song the memories of the 90s No, I just like it"," I like the singers voice, the band, and the song /  No, I just like it",,,,,,,Racial division,,,,,,,,,,,,,," I like the singers voice, the band, and the song ",," I like the singers voice, the band, and the song / The singer, the song the memories of the 90s",,,,,,,,,,,,,,,,,"The singer, the song the memories of the 90s",,,,,,,,,,,,,,,,,,,,,,,,,,,,,,,,,," No, I just like it",
304,b,"Being on the London Underground in the 80s I like the jam Very evocative lyrics, like Paul weller and the Jam No, once again I just like the song"," No, once again I just like the song",,,,,,"Very evocative lyrics, like Paul weller and the Jam ",,,,,,,,,,,,,,,,," I like the jam / Very evocative lyrics, like Paul weller and the Jam ",Being on the London Underground in the 80s,,,,,,,,,,,,,Being on the London Underground in the 80s,,,,,,,,,,,,,,,,,,,,,,,,,,,,,,,,,,,,," No, once again I just like the song",
305,a,"Expressionist, flowing I collect and keep lossless files Detailed, evolving solo piano that stays interesting No, part of a very large collection of classical music but more of academic interest than a favourite composer. ",,,,,,"Expressionist, flowing I collect and keep lossless files, Detailed, evolving solo piano that stays interesting ",,,,,," Detailed, evolving solo piano that stays interesting",,,,,,,,,,,,,,"Expressionist, flowing I collect and keep lossless files / No, part of a very large collection of classical music but more of academic interest than a favourite composer. ",,,,,,,,,,,,,,,,,,,,,,,,,,,,,,,,,,,,,,,,,,,,,,,,,"No, part of a very large collection of classical music but more of academic interest than a favourite composer. ",
305,b,"Geometry Decent album Really nice harmonically rich synth arps and counterpoint Yes, I was given this album as a pre-release promo copy when I won a music production competition, along with some other stuff",,,,,,,,,,,,Really nice harmonically rich synth arps and counterpoint ,,,,,,Really nice harmonically rich synth arps and counterpoint ,,,,," Decent album / Yes, I was given this album as a pre-release promo copy when I won a music production competition, along with some other stuff",,,,,,,,,,,,,,,"Yes, I was given this album as a pre-release promo copy when I won a music production competition, along with some other stuff",,,,,,,,,,,,,,,,,,,,,,,,Geometry,,,,,,,,,,,,,,
306,a,"It has been a very long time since I listened to this song. There was a time when I used to think Jeff Buckley was brilliant, but these days I don't feel very connected to his music. Listening to it I very much feel a melancholic longing back to my younger days when my life was simple enough that I could indulge in ""buckleyesce"" sensitivities. I used to be very much in that mindset, but growing older has rearranged my emotional priorities.  To be clear I want to point out that I do not use a listening device, I listen to all my music on youtube and do not make playlists. In order to get random song selection I scrolled down in my youtube suggestion list to the first song suggestion that I actually have listened to before. To my surprise, this came up. So I did not save it to my device, however I did do so many years ago when I first heard it. The reason back then was basically for research purposes (ie learning the parts), as I play guitar myself and thought it was brilliantly sung and played.


 I have mixed feelings with it, there's defenitely a sense of beauty in the performance and delivery, but at the same time the emotional delivery seem less relevant in my life today. Perhaps there's an uneasyness that comes with that realisation. No. When I first heard it I thought it was a beautifull sounding song, but it never grew on me like other songs have. I didn't end up listening to this song a lot.","The reason back then was basically for research purposes (ie learning the parts), as I play guitar myself and thought it was brilliantly sung and played./  No. When I first heard it I thought it was a beautifull sounding song, but it never grew on me like other songs have. I didn't end up listening to this song a lot.",,"There was a time when I used to think Jeff Buckley was brilliant, but these days I don't feel very connected to his music./  No. When I first heard it I thought it was a beautifull sounding song, but it never grew on me like other songs have. I didn't end up listening to this song a lot.",,,,," I have mixed feelings with it, there's defenitely a sense of beauty in the performance and delivery, but at the same time the emotional delivery seem less relevant in my life today. ",,,,,,"The reason back then was basically for research purposes (ie learning the parts), as I play guitar myself and thought it was brilliantly sung and played. /  I have mixed feelings with it, there's defenitely a sense of beauty in the performance and delivery, but at the same time the emotional delivery seem less relevant in my life today. ",,,,,,,,"The reason back then was basically for research purposes (ie learning the parts), as I play guitar myself and thought it was brilliantly sung and played.",,"There was a time when I used to think Jeff Buckley was brilliant, but these days I don't feel very connected to his music.",,,,,,,," To be clear I want to point out that I do not use a listening device, I listen to all my music on youtube and do not make playlists.  In order to get random song selection I scrolled down in my youtube suggestion list to the first song suggestion that I actually have listened to before. To my surprise, this came up. So I did not save it to my device, however I did do so many years ago when I first heard it.",,,,,,,,,"Listening to it I very much feel a melancholic longing back to my younger days when my life was simple enough that I could indulge in ""buckleyesce"" sensitivities. I used to be very much in that mindset, but growing older has rearranged my emotional priorities. ",,It has been a very long time since I listened to this song. ,,"The reason back then was basically for research purposes (ie learning the parts), as I play guitar myself and thought it was brilliantly sung and played.",,,,,,,,,,,,,,,,,,,,,,"Listening to it I very much feel a melancholic longing back to my younger days when my life was simple enough that I could indulge in ""buckleyesce"" sensitivities. I used to be very much in that mindset, but growing older has rearranged my emotional priorities. ",Perhaps there's an uneasyness that comes with that realisation. ,,,,,"Listening to it I very much feel a melancholic longing back to my younger days when my life was simple enough that I could indulge in ""buckleyesce"" sensitivities. I used to be very much in that mindset, but growing older has rearranged my emotional priorities. "," I have mixed feelings with it, there's defenitely a sense of beauty in the performance and delivery, but at the same time the emotional delivery seem less relevant in my life today. "," No. When I first heard it I thought it was a beautifull sounding song, but it never grew on me like other songs have. I didn't end up listening to this song a lot.",
306,b,"How do these songs end up in my suggested list! I haven't listened to it for so long, yet somehow youtube knows this is my music. I listened to Bob Dylan when I was quite young, finding the records in my dad's record collection, and got myself familiar on the guitar playing many of his songs. I have also listened to Johnny Cash a lot and like his delivery very much. The type of vibe that this performance gives off is one that comes very easy for me to create with my own music, although I do prefer a more european sound. I do like this song a lot;  the original recording of it by Bob Dylan has one of my all time favorite picking patterns. This particular performance is nice because Bob Dylan starts off singing his verse in his (at that time) regular style, after which Cash gives a very heartfelt rendition of his verse, changing the mood. Upon experiencing the delivery by Cash, Dylan subsequently adapts his delivery of the next verse to a similar passionate style. Again, not recently saved, but saved when I first heard it. I like this song and like the cooperation of the two musicians whom I both like.  Let's be honest, it is kind of a boring song if your not in the mood for it. But it is one that has become part of my history. I must say I was expecting to find songs that I have been listening to more recently and that I feel more emotionally connected to at this very moment, which would have perhaps made for more interesting writing, but song selection was definitely random and unexpected. The original recording of this song has one of my favorite picking patterns. As far as playing this myself, of all of Dylan's songs (of which I learned, and forgotten, many) this is in the top few songs that have stayed with me and I still enjoy playing. So it must appeal to me in a special way. Although I have never given this any thought conciously, I must say the theme of distant love is definitely one that I know myself to be drawn to.","I have also listened to Johnny Cash a lot and like his delivery very much. / As far as playing this myself, of all of Dylan's songs (of which I learned, and forgotten, many) this is in the top few songs that have stayed with me and I still enjoy playing So it must appeal to me in a special way. Although I have never given this any thought conciously, I must say the theme of distant love is definitely one that I know myself to be drawn to.",,"The type of vibe that this performance gives off is one that comes very easy for me to create with my own music, although I do prefer a more european sound./ Let's be honest, it is kind of a boring song if your not in the mood for it.",,,,," So it must appeal to me in a special way. Although I have never given this any thought conciously, I must say the theme of distant love is definitely one that I know myself to be drawn to.",,,,,,I do like this song a lot;  the original recording of it by Bob Dylan has one of my all time favorite picking patterns. ,,,,"This particular performance is nice because Bob Dylan starts off singing his verse in his (at that time) regular style, after which Cash gives a very heartfelt rendition of his verse, changing the mood. ","The type of vibe that this performance gives off is one that comes very easy for me to create with my own music, although I do prefer a more european sound."," Upon experiencing the delivery by Cash, Dylan subsequently adapts his delivery of the next verse to a similar passionate style",,,,". I listened to Bob Dylan when I was quite young, finding the records in my dad's record collection, and got myself familiar on the guitar playing many of his songs. / I have also listened to Johnny Cash a lot and like his delivery very much. / I do like this song a lot;  the original recording of it by Bob Dylan has one of my all time favorite picking patterns. /  I like this song and like the cooperation of the two musicians whom I both like.  ",,,The original recording of this song has one of my favorite picking patterns.,,,,,,,," Again, not recently saved, but saved when I first heard it.",,,But it is one that has become part of my history.,,,". I listened to Bob Dylan when I was quite young, finding the records in my dad's record collection, and got myself familiar on the guitar playing many of his songs. ",,"How do these songs end up in my suggested list! I haven't listened to it for so long, yet somehow youtube knows this is my music.",,". I listened to Bob Dylan when I was quite young, finding the records in my dad's record collection, and got myself familiar on the guitar playing many of his songs. / The type of vibe that this performance gives off is one that comes very easy for me to create with my own music, although I do prefer a more european sound./ As far as playing this myself, of all of Dylan's songs (of which I learned, and forgotten, many) this is in the top few songs that have stayed with me and I still enjoy playing",,,". I listened to Bob Dylan when I was quite young, finding the records in my dad's record collection, and got myself familiar on the guitar playing many of his songs. ",,,,,,,,,,,,,,,,,,,"This particular performance is nice because Bob Dylan starts off singing his verse in his (at that time) regular style, after which Cash gives a very heartfelt rendition of his verse, changing the mood. ",,,,,,,"Let's be honest, it is kind of a boring song if your not in the mood for it.",,
307,a,"I haven't heard this one in a while!  I have this entire album saved (Settle Down). It's only a minor track on here (less than a minute long) and I wouldn't have downloaded it on its own, simply because it's not worth the money to pay for a single track that short! I like all of Julia Nunes' music, and this one displays her talent for harmonies.  No. It's not my favourite track on the album, and, like I said, it's very short. ","I like all of Julia Nunes' music, and this one displays her talent for harmonies.",,"No. It's not my favourite track on the album, and, like I said, it's very short. ",,,,,,,,,,,"I like all of Julia Nunes' music, and this one displays her talent for harmonies.",,,,,,,,,"I have this entire album saved (Settle Down). / It's only a minor track on here (less than a minute long) and I wouldn't have downloaded it on its own, simply because it's not worth the money to pay for a single track that short! / No. It's not my favourite track on the album, and, like I said, it's very short. ","I like all of Julia Nunes' music, and this one displays her talent for harmonies.",,,,,,,,"It's only a minor track on here (less than a minute long) and I wouldn't have downloaded it on its own, simply because it's not worth the money to pay for a single track that short! ",,,,,,,,,,,I haven't heard this one in a while! ,,,,,,,,,,,,,,,,,,,,,,,,,,,,,,,,"No. It's not my favourite track on the album, and, like I said, it's very short. ",
307,b,"I don't remember this track at all... I don't have a lot of storage on my phone, and usually when I refresh the music contents I go through iTunes sync and select a few artists that I want to copy over to my phone. I think I was interested in downloading another of Marina's songs and ticked the artist box, but I probably wasn't specifically interested in this track. I'm not sure why I have it in the first place. Maybe I own the entire album, but I don't think I do...It could have been a free download at some point. It's just not very interesting musically. It doesn't have a good hook, and is barely memorable. No. As I said, it's not very memorable. ",,," I'm not sure why I have it in the first place. Maybe I own the entire album, but I don't think I do...It could have been a free download at some point. It's just not very interesting musically. ",,I don't remember this track at all... I,,,,,," It doesn't have a good hook, and is barely memorable. No. As I said, it's not very memorable. ",,,,,,,,,,,," I'm not sure why I have it in the first place. Maybe I own the entire album, but I don't think I do...It could have been a free download at some point. It's just not very interesting musically. "," I think I was interested in downloading another of Marina's songs and ticked the artist box, but I probably wasn't specifically interested in this track.",,,, I go through iTunes sync and select a few artists that I want to copy over to my phone.,,,,,,,,,,,,,,,,,,,,,,,,,,,,,,,,,,,,,,,,,,,,,,," It doesn't have a good hook, and is barely memorable. No. As I said, it's not very memorable. ",
308,a,"Smooth as a motherfucker Coz it's freakin' delicious  Makes me wanna dance but at the same time sit on a big couch bopping my head Yes. It's a good tune to stick on at the turning pint of a night. Gets people dancing and chatting but it's not mad intense. As I said, smooth as a motherfucker", Coz it's freakin' delicious,,,,,"Smooth as a motherfucker/ As I said, smooth as a motherfucker",,,,,,,,,,,,,,,,,,,,,,,,,,,,,,,,,,,,,,,,,,,,,,,,Makes me wanna dance but at the same time sit on a big couch bopping my head/ Gets people dancing and chatting but it's not mad intense.,,,. It's a good tune to stick on at the turning pint of a night. Gets people dancing and chatting ,,,,,,,,,,Gets people dancing and chatting but it's not mad intense.,,,,,,,,,
308,b,"Haven't heard this before but I like it Saved the album it comes from Beautiful strings, nice summery hip hop instrumental. Nice chopping and sampling No",Haven't heard this before but I like it ,,,,Haven't heard this before but I like it ,,,,,,,"Beautiful strings, nice summery hip hop instrumental. ",,,,,, Nice chopping and sampling,,,,,Saved the album it comes from ,,,"Beautiful strings, nice summery hip hop instrumental. ",,,,,,,,,,,,,,,,,,,,,,,,,,,,,,,,,,,,,,,"Beautiful strings, nice summery hip hop instrumental. ",,,,,,,,,,No,
309,a,"The album cover and the fact that Patti Smith collaborated with Bruce Springsteen around this time. I didn't choose to save this particular track to my device, but rather the album it's on. (Also, this track is not actually saved on my device -- it's in the cloud.) This is a cover of a Roger McGuinn track originally recorded by The Byrds. I generally like McGuinn's writing and I think this is a well executed cover, although the 'big beat' drum production on the snare is a bit much -- era-appropriate, though. Not really. I have more of a relationship with the original version of the song, but not with this exact incarnation of it. I always want to like Patti Smith more than I do."," I generally like McGuinn's writing and I think this is a well executed cover, although the 'big beat' drum production on the snare is a bit much -- era-appropriate, though.",," I generally like McGuinn's writing and I think this is a well executed cover, although the 'big beat' drum production on the snare is a bit much -- era-appropriate, though.",,,,,,,,," I generally like McGuinn's writing and I think this is a well executed cover, although the 'big beat' drum production on the snare is a bit much -- era-appropriate, though.",," I generally like McGuinn's writing and I think this is a well executed cover, although the 'big beat' drum production on the snare is a bit much -- era-appropriate, though."," I generally like McGuinn's writing and I think this is a well executed cover, although the 'big beat' drum production on the snare is a bit much -- era-appropriate, though.",,,,,,,,"The album cover and the fact that Patti Smith collaborated with Bruce Springsteen around this time/ I didn't choose to save this particular track to my device, but rather the album it's on.","The album cover and the fact that Patti Smith collaborated with Bruce Springsteen around this time/ This is a cover of a Roger McGuinn track originally recorded by The Byrds./ Not really. I have more of a relationship with the original version of the song, but not with this exact incarnation of it. I always want to like Patti Smith more than I do."," I generally like McGuinn's writing and I think this is a well executed cover, although the 'big beat' drum production on the snare is a bit much -- era-appropriate, though.",,"This is a cover of a Roger McGuinn track originally recorded by The Byrds./ Not really. I have more of a relationship with the original version of the song, but not with this exact incarnation of it. I always want to like Patti Smith more than I do.",,,,,,,,,,,,,,,,,,,,,,,,,,,,,,,,,,,,,,,,,,,,,,,,"Not really. I have more of a relationship with the original version of the song, but not with this exact incarnation of it. I always want to like Patti Smith more than I do.",
309,b,"A musician I once knew told me he thought The Attractions were the greatest backing band of all time. I really respect his opinion, so that comes to mind. I also thought of two other Costello tracks that I really like and listen to much more frequently: 'Green Shirt' and 'Little Triggers.' I think they're from the same record, definitely from the same era. Again, this track isn't saved on my device. It's in the cloud. I purchased it, and therefore added it to my cloud, because I really like Costello. High quality musicianship, good production, intelligent lyrics. Yes. I go through periods of listening to Costello every once in a while -- maybe once or twice a year. As such, it reminds me of driving on PCH or around town. (I listen to music a lot in my car.)"," I purchased it, and therefore added it to my cloud, because I really like Costello. ",,,,,," High quality musicianship, good production, intelligent lyrics. ",,,,,,," High quality musicianship, good production, intelligent lyrics. "," High quality musicianship, good production, intelligent lyrics. ",,,,,,,,,"A musician I once knew told me he thought The Attractions were the greatest backing band of all time. I really respect his opinion, so that comes to mind./  I also thought of two other Costello tracks that I really like and listen to much more frequently: 'Green Shirt' and 'Little Triggers.' /  I purchased it, and therefore added it to my cloud, because I really like Costello. / Yes. I go through periods of listening to Costello every once in a while -- maybe once or twice a year."," I think they're from the same record, definitely from the same era. ",,,,,,,,,,,,,,,,,,,,,,,,"A musician I once knew told me he thought The Attractions were the greatest backing band of all time. I really respect his opinion, so that comes to mind.",,,,,,"As such, it reminds me of driving on PCH or around town. (I listen to music a lot in my car.)",,,,,,,,,,,,,,,,,,,,,
310,a,"This is a great running track. It has kept me motivated lots of times. It makes me want to move. When I make running playlists, especially for specific events or training sessions, I want music that will spur me on. This still does that many years after I first heard it. It makes me want to move. Not really. It doesn't remind me of any specific runs. Some tracks I have on my ipod, I can remember hearing them at specific points in specific runs or events. ",,,,,,,,,,,,,,,,,,,,,,,,,,,,,,,," When I make running playlists, especially for specific events or training sessions, I want music that will spur me on.",,,,,,,,,,,,,,,,,,,,,, It makes me want to move/  It makes me want to move. ,,This is a great running track.,,,,,,,,,,,,,,,,". It has kept me motivated lots of times. / When I make running playlists, especially for specific events or training sessions, I want music that will spur me on. This still does that many years after I first heard it.",,,"Not really. It doesn't remind me of any specific runs. Some tracks I have on my ipod, I can remember hearing them at specific points in specific runs or events. ",
