108,a,"Christmas time, teaching it to children on the piano, why on earth do I still have this song still on my iPod?  For doing a Christmas gig where I needed to provide Christmas songs as part of background music. The track itself is a great catchy tune but it has lost its appeal after teaching it over and over again.  However I love the Jackson 5 on the whole so I will still feel good listening to it. Yes.  I usually get a ""love/hate"" relationship with songs I have to learn and teach.  I'll could go mad with it still on my head hours after.","The track itself is a great catchy tune but it has lost its appeal after teaching it over and over again.  / However I love the Jackson 5 on the whole so I will still feel good listening to it./ Yes.  I usually get a ""love/hate"" relationship with songs I have to learn and teach.  I'll could go mad with it still on my head hours after.",,"The track itself is a great catchy tune but it has lost its appeal after teaching it over and over again.  / Yes.  I usually get a ""love/hate"" relationship with songs I have to learn and teach.  I'll could go mad with it still on my head hours after.",,,The track itself is a great catchy tune but it has lost its appeal after teaching it over and over again.  ,,,,,The track itself is a great catchy tune but it has lost its appeal after teaching it over and over again.  ,,,,,,,,,,,,,However I love the Jackson 5 on the whole so I will still feel good listening to it.,,,,,,,,,,,,,For doing a Christmas gig where I needed to provide Christmas songs as part of background music,,,,,,why on earth do I still have this song still on my iPod?,,"teaching it to children on the piano, / The track itself is a great catchy tune but it has lost its appeal after teaching it over and over again.  / Yes.  I usually get a ""love/hate"" relationship with songs I have to learn and teach.  I'll could go mad with it still on my head hours after.",,,,,,,,,,,,,,,,,,,"Christmas time, / For doing a Christmas gig where I needed to provide Christmas songs as part of background music",,,,,,,However I love the Jackson 5 on the whole so I will still feel good listening to it.,,,,,
108,b,"Flashback to my first ""Now that's what I call music"" compilations from my childhood and school discos.  I can't help but tap my foot! It's a guilty pleasure and I love nostalgic emotions from the song.  Plus it's just a great tune, it hits everything I like. It reminds me of when I was first getting into music, especially listening to cheesy pop tunes over and over again.  It's extremely catchy but not following the usual commercial musical vibes of the time.  The lyrics make me feel uplifted.  Plus I love the epic over the top guitar solo. Yes but it only makes an appearance every so often when I need a boost and satisfy that nostalgia moment fix."," It's a guilty pleasure and I love nostalgic emotions from the song./ Plus it's just a great tune, it hits everything I like./ Plus I love the epic over the top guitar solo.",,,,,"It's a guilty pleasure and I love nostalgic emotions from the song,  It's extremely catchy but not following the usual commercial musical vibes of the time.  The lyrics make me feel uplifted", The lyrics make me feel uplifted.,,,,,Plus I love the epic over the top guitar solo.,,,,,,,,,,,,, It's extremely catchy but not following the usual commercial musical vibes of the time.," It reminds me of when I was first getting into music, especially listening to cheesy pop tunes over and over again.",,,,,,,,,,,,,,,"Flashback to my first ""Now that's what I call music"" compilations from my childhood and school discos./  It reminds me of when I was first getting into music, especially listening to cheesy pop tunes over and over again.",,, It's a guilty pleasure and I love nostalgic emotions from the song./ Yes but it only makes an appearance every so often when I need a boost and satisfy that nostalgia moment fix.,,,,,,,,,, I can't help but tap my foot! ,,,,,,,,,,,,,,,,, The lyrics make me feel uplifted.,,,,,
109,a,"It makes me think about my dad, it's one of his favourite songs  I like the song and also because it's something my dad got me in to  I just think it's a good song  Yes- it's a personal song, because it makes me thinks about my dad and our relationship ", I like the song and also because it's something my dad got me in to /  I just think it's a good song ,"It makes me think about my dad, it's one of his favourite songs",,,,,,"Yes- it's a personal song, because it makes me thinks about my dad and our relationship ",,,,,,,,,,,,,,,,,,,,,,,,,,,,,,,,,,,,,,,,"It makes me think about my dad, it's one of his favourite songs / Yes- it's a personal song, because it makes me thinks about my dad and our relationship ",,,, I like the song and also because it's something my dad got me in to,,,,,,,,,,,,,,,,,,,,,,,,
109,b,"Waiting to hear my favourite part of the song  I saved it because I really like the band  I like the song, I like how I can sing along to it  No- I wouldn't say I have a relationship with it, I just like the song ","I saved it because I really like the band/   I like the song, I like how I can sing along to it  / No- I wouldn't say I have a relationship with it, I just like the song ",Waiting to hear my favourite part of the song,,,,,,,,,,,,,,,,,,,,,,I saved it because I really like the band,,,,,,,,,,,,,,,,,,,,,,,,,,,,,,,,,,"  I like the song, I like how I can sing along to it  ",,,,,,,,,,,,,,,,,"No- I wouldn't say I have a relationship with it, I just like the song ",
110,a,Summer and Happiness  Makes me feel good Makes me fell good and like dancing No,,,,,,Summer and Happiness,,,,,,,,,,,,,,,,,,,,,,,,,,,,,,Summer and Happiness,,,,,,,,,,,,,,,,,,Makes me feel good Makes me fell good and like dancing,,,,,,,,,,,Summer and Happiness,,,,,,Makes me feel good Makes me fell good and like dancing,,,,No,
110,b,Catchy good feeling Love it and like this band Good to listen or dance to Reminds me of lying in the sun on holiday and listening to this on my ipod,Love it and like this band /  Good to listen or dance to ,,,,,Catchy good feeling,,,,,,,,,,,,,,,,,,Love it and like this band ,,,,,,,,,,,,,,,Reminds me of lying in the sun on holiday and listening to this on my ipod,,,,,,,,,,,,,,, Good to listen or dance to ,,,,,,,,,Reminds me of lying in the sun on holiday and listening to this on my ipod,,,,good feeling,,,,,,,,,
111,a,"The club in stoke, names sugarmill Yes Good song, my main genre of music, catchy.  Not really. Other than being my genre of music, i dont listen to the band otherwise",," Yes Good song, my main genre of music, catchy.",,,,"Good song, my main genre of music, catchy.",,,,,,,,,,,,,,,,,," Not really. Other than being my genre of music, i dont listen to the band otherwise",," Yes Good song, my main genre of music, catchy./  Not really. Other than being my genre of music, i dont listen to the band otherwise",,,,,,,,,,,,,,"The club in stoke, names sugarmill",,,,,,,,,,,,,,,,,"The club in stoke, names sugarmill",,,,,,,,,,,,,,,,,," Not really. Other than being my genre of music, i dont listen to the band otherwise",
111,b,"My dad loves this song, also the first song i got on my vinyl Because i like the happy mondays. Its got good rhythm and is a song i like to play when im getting ready to go out o a club Good music Yes, my dad loves it and played it growing up also the band members live on my street back home so the band is still big", Good music,,,,,,,,,,,,,,, Its got good rhythm and is a song i like to play when im getting ready to go out o a club,,,,,,,," Because i like the happy mondays./ Yes, my dad loves it and played it growing up also the band members live on my street back home so the band is still big",,,,,,,,,,, also the first song i got on my vinyl ,,,,,,"My dad loves this song, also the first song i got on my vinyl/ Yes, my dad loves it and played it growing up also the band members live on my street back home so the band is still big",,,,,,,"My dad loves this song, also the first song i got on my vinyl/ Yes, my dad loves it and played it growing up also the band members live on my street back home so the band is still big",,,,,,,,, Its got good rhythm and is a song i like to play when im getting ready to go out o a club,,,,,,,,,,,,,,,,,,,
112,a,"80s nostalgia  Part of an album I downloaded for Christmas background music Warm feelings, memories of my youth, Christmas feeling No. No special memories associated with this track, like listening to it with a special person or over and over again during a certain time of life.","No. No special memories associated with this track, like listening to it with a special person or over and over again during a certain time of life.",,,,,,,,,,,,,,,,,,,,,,Part of an album I downloaded for Christmas background music ,,80s nostalgia,,,,,,,,,,,"Warm feelings, memories of my youth, Christmas feeling",,,,,"80s nostalgia/ Warm feelings, memories of my youth, Christmas feeling / No. No special memories associated with this track, like listening to it with a special person or over and over again during a certain time of life.",,,80s nostalgia,,"No. No special memories associated with this track, like listening to it with a special person or over and over again during a certain time of life.",,,,,,,,,,,,,,,,,,"Part of an album I downloaded for Christmas background music / Warm feelings, memories of my youth, Christmas feeling",,,,,,,,,,,"No. No special memories associated with this track, like listening to it with a special person or over and over again during a certain time of life.",
112,b,"The faces of my friends whose song this is I love all this group's songs, so this song was added as part of one of their albums. Love the sound of the language, the meaning of the words, it makes me want to move with the music I know the artists personally and can see their faces in my mind, smiling at me as I listen. I have also performed the song myself, and it was a very beautiful, emotional experience.","I love all this group's songs, so this song was added as part of one of their albums./ I have also performed the song myself, and it was a very beautiful, emotional experience.",,,,,,"Love the sound of the language, the meaning of the words, it makes me want to move with the music","I have also performed the song myself, and it was a very beautiful, emotional experience.",,,,,,,,,,,,,,,"I love all this group's songs, so this song was added as part of one of their albums.","The faces of my friends whose song this is/ I love all this group's songs, so this song was added as part of one of their albums./  know the artists personally and can see their faces in my mind, smiling at me as I listen. ",,,,,,,,,,,,,,,,,,,,,"I have also performed the song myself, and it was a very beautiful, emotional experience.",,,,The faces of my friends whose song this is,,,,,"Love the sound of the language, the meaning of the words, it makes me want to move with the music",,,,,,,,,,,,,,,,,,,,,,
113,a,"Definitely the best version of this song  I love to sing along to it  Nice guitar, Jeff Buckley's voice is beautiful. Soft but still moving.  Yes, me and my dad used to listen to this song together in the car. Buckley is our last name, which means a lot to me as it shows we're family (I'm adopted). "," I love to sing along to it / Definitely the best version of this song/ Nice guitar, Jeff Buckley's voice is beautiful. ",,,,, Soft but still moving,," Soft but still moving. / Buckley is our last name, which means a lot to me as it shows we're family (I'm adopted). ",,,,"Nice guitar, Jeff Buckley's voice is beautiful. ",,,,,,,,,,"Nice guitar, Jeff Buckley's voice is beautiful. ",,"Nice guitar, Jeff Buckley's voice is beautiful. / Buckley is our last name, which means a lot to me as it shows we're family (I'm adopted). ",,,Definitely the best version of this song ,,,,,,,,,,,,,,,,,,,,,"Yes, me and my dad used to listen to this song together in the car. / Buckley is our last name, which means a lot to me as it shows we're family (I'm adopted). ",,,,,,,"Yes, me and my dad used to listen to this song together in the car. ",,, I love to sing along to it,,,,,,,,,,,,,,,,,,
113,b,"Interesting voice, is that a ukelele? It's fun, can have a little jig to it  Nice voice, good melody, can sing along to it.  Yes, I have a video of my nephew dancing to this when he was 5 so about 6 years ago. He lives quite far away so I don't see him often. This song reminds me of him. ",,,,,,"It's fun, can have a little jig to it, Interesting ",,,,,,"Interesting voice, is that a ukelele? ","Nice voice, good melody, can sing along to it",,,,,,,,,"Interesting voice, is that a ukelele? ",,,,,,,,,,,,,,,,,,,,,,,,,," Yes, I have a video of my nephew dancing to this when he was 5 so about 6 years ago. He lives quite far away so I don't see him often. This song reminds me of him. ",,,,,," It's fun, can have a little jig to it",,,,"Nice voice, good melody, can sing along to it",,,,,,,, ,,,,,,,,,,
114,a,"A state of mind to program in  When working on my IT projects I like to have music that puts me in a trance.
This track is used in the movie ""The Social Network"" and I adore the scene.
the movie is not very good but it inspires me to keep on working on programs/games It calls me down and gives me focus No","This track is used in the movie ""The Social Network"" and I adore the scene.",,,,,,,,,,,,,,,,,,,,,,,,,,,,"This track is used in the movie ""The Social Network"" and I adore the scene.",,,,,,,,,,,,,,,,,,,,,,,,,,,,,,,,A state of mind to program in  / When working on my IT projects I like to have music that puts me in a trance.,,,,,A state of mind to program in / When working on my IT projects I like to have music that puts me in a trance.,,,the movie is not very good but it inspires me to keep on working on programs/games It calls me down and gives me focus No,,,the movie is not very good but it inspires me to keep on working on programs/games It calls me down and gives me focus No,,, No,
114,b,War\I enjoyed the movie and its soundtrack a lot\calms my mind down\no,I enjoyed the movie and its soundtrack a lot,,,,,,,,,,,,,,,,,,,,,,,,,,,,I enjoyed the movie and its soundtrack a lot\,,,,,,,,,,,,,,,,,,,,,,,,,,,,,,,,,War,,,,,,,calms my mind down,,,,,,no,
115,a,"family It's by a bluegrass band I have seen perform twice with my husband, and we often play their CDs in the car with the family. Great musicianship, love the fiddle, good memories of listening to it both live and with my children and husband. Yes, see above.","Great musicianship, love the fiddle, good memories of listening to it both live and with my children and husband. ",,,,,,,,,,,"Great musicianship, love the fiddle, good memories of listening to it both live and with my children and husband. ",,"Great musicianship, love the fiddle, good memories of listening to it both live and with my children and husband. ",,,,,,,,,,"It's by a bluegrass band I have seen perform twice with my husband, and we often play their CDs in the car with the family. ",,,,,,,,,,,,,"It's by a bluegrass band I have seen perform twice with my husband, and we often play their CDs in the car with the family. / Great musicianship, love the fiddle, good memories of listening to it both live and with my children and husband. ",,,,,,,,,,,"family / It's by a bluegrass band I have seen perform twice with my husband, and we often play their CDs in the car with the family.  / Great musicianship, love the fiddle, good memories of listening to it both live and with my children and husband. ",,,"It's by a bluegrass band I have seen perform twice with my husband, and we often play their CDs in the car with the family. / Great musicianship, love the fiddle, good memories of listening to it both live and with my children and husband. ",,,,"It's by a bluegrass band I have seen perform twice with my husband, and we often play their CDs in the car with the family. ",,,,,,,,,,,,,,,,,,,,,
115,b,"Love Again, I saw him perform live twice and loved the man for his music and poetry.  I love the sentiment of the song. I love the deep, gravelly sound of Leonard Cohen's voice, and the beautiful lyrics and melody.  Yes, as per my earlier answer - I saw him perform twice here in Brighton and was completely bowled over especially after the first concert, because I had never really listened to his music before.  And my husband put it on a compilation CD for me once.",,,,,,,"I saw him perform live twice and loved the man for his music and poetry./  I love the deep, gravelly sound of Leonard Cohen's voice, and the beautiful lyrics and melody",  I love the sentiment of the song. ,,,,," I love the deep, gravelly sound of Leonard Cohen's voice, and the beautiful lyrics and melody","I saw him perform live twice and loved the man for his music and poetry./  I love the deep, gravelly sound of Leonard Cohen's voice, and the beautiful lyrics and melody",,,,,,,," I love the deep, gravelly sound of Leonard Cohen's voice, and the beautiful lyrics and melody",," I love the deep, gravelly sound of Leonard Cohen's voice, / Yes, as per my earlier answer - I saw him perform twice here in Brighton and was completely bowled over especially after the first concert, because I had never really listened to his music before.",,,,,,,,,,," I saw him perform twice here in Brighton and was completely bowled over especially after the first concert, because I had never really listened to his music before.  And my husband put it on a compilation CD for me once.",,"I saw him perform live twice and loved the man for his music and poetry./ Yes, as per my earlier answer - I saw him perform twice here in Brighton and was completely bowled over especially after the first concert, because I had never really listened to his music before.  ",,,,,,,,,,,,,,And my husband put it on a compilation CD for me once.,,,,,,,,,,,,,,,,,,,,,,,,,
116,a,"Being in secondary school with my friends  It brings back memories.
I like the song.  I associate the song with my early years at secondary school. I also saw Scouting for girls at a concert which was specifically for Girl Guiding. 
It is upbeat and it has a good drumbeat. It is also recognisable by the heartbeat sound effect at the beginning and end of the song.  Yes, it brings back memories. ",I like the song. / It is upbeat and it has a good drumbeat. ,,,,,,," It brings back memories. / Yes, it brings back memories. ",,It is upbeat and it has a good drumbeat. ,,It is upbeat and it has a good drumbeat. ,,,It is also recognisable by the heartbeat sound effect at the beginning and end of the song. ,,,It is also recognisable by the heartbeat sound effect at the beginning and end of the song. ,,,,,,I also saw Scouting for girls at a concert which was specifically for Girl Guiding. ,,,,,,,,,,,,,I also saw Scouting for girls at a concert which was specifically for Girl Guiding. ,,,,Being in secondary school with my friends /  I associate the song with my early years at secondary school.,,,,,,,Being in secondary school with my friends ,,,,,,,,,,,,,,,,,,,,,,,,,,,,
116,b,I'm not sure that I know the song. However then the singing entered and I recognised it.  It was on a compilation cd of love songs that I put on my iPod when I first bought my iPod. It's relaxing.  No,,,,However then the singing entered and I recognised it. ,I'm not sure that I know the song.,,,,,,,,,,,,,,,,,However then the singing entered and I recognised it. , It was on a compilation cd of love songs that I put on my iPod when I first bought my iPod. ,,,,,,,,, It was on a compilation cd of love songs that I put on my iPod when I first bought my iPod,,,,,,,,,,,,,,,,,,,,,,,,,,,,,,,,,,,,, It's relaxing.  ,,,,,, No,
117,a,"it's a catchy tune /I like the artist and this song is nice to sing along to /i like the song lyrics /No, don't have any particular event in my life attached to this song",I like the artist and this song is nice to sing along to / /i like the song lyrics ,,,,,catchy ,/i like the song lyrics ,,,,,,,,,,,,,,,,,I like the artist and this song is nice to sing along to,,,,,,,,,,,,,,,,,,,,,,,,,,,,,,,,,,I like the artist and this song is nice to sing along to,,,,,,,,,,,,,,,,,"No, don't have any particular event in my life attached to this song",
117,b,I love the harmonies and melodies \It's my favourite song by The Calling \it's fun to play along to on guitar and sing along with\it reminds me of the series 'the chronicles of narnia',,It's my favourite song by The Calling,,,,,,,,,,,I love the harmonies and melodies,,,,,I love the harmonies and melodies,,,,,,It's my favourite song by The Calling,,,,,,,,,it reminds me of the series 'the chronicles of narnia',,,,,,,,,,,,it's fun to play along to on guitar and sing along with,,,,,,,,,,,,,it's fun to play along to on guitar and sing along with,,,,,,,,,,,,,,,,,,
118,a,"Love, liveliness, infatuation/I love how upbeat it is, how different it is to modern music. I love the vivacity of it and of course Armstrong's rich voice./It puts me into a good mood./Yes. As I said it can change my mood, make me feel like dancing and transport me into a different era.","I love how upbeat it is, how different it is to modern music./  I love the vivacity of it and of course Armstrong's rich voice./",,,,," Upbeat,  Love, liveliness, infatuation, love the vivacity",,,,"I love how upbeat it is, how different it is to modern music.",,,, I love the vivacity of it and of course Armstrong's rich voice./,,,,,,,, I love the vivacity of it and of course Armstrong's rich voice./,, I love the vivacity of it and of course Armstrong's rich voice./,"/Yes. As I said it can change my mood, make me feel like dancing and transport me into a different era.","I love how upbeat it is, how different it is to modern music.",,,,,,,,,,,,,,,,,,,,,,,,,,,,"/Yes. As I said it can change my mood, make me feel like dancing and transport me into a different era.",,,,,,,,,,,,,/It puts me into a good mood,,,,"/It puts me into a good mood/ /Yes. As I said it can change my mood, make me feel like dancing and transport me into a different era.",,,,,
118,b,"Religion, self restraint, peace\I find it calming and I like the Beatles\I like how gentle the rhythm and vocals are. \Yes. When I'm mad or stressed about something or someone I tend to listen to it and it calms me.",\I like how gentle the rhythm and vocals are. ,,,,,"Religion, self restraint, peace",,,,,,,,,,\I like how gentle the rhythm and vocals are. ,,,,,,\I like how gentle the rhythm and vocals are. ,,I find it calming and I like the Beatle,,,,,,,,,,,,,,,,,,,,,,,,,,,,,,,,,,,,,,,,,,,,,I find it calming and I like the Beatle/ Yes. When I'm mad or stressed about something or someone I tend to listen to it and it calms me.,,,,,Yes. When I'm mad or stressed about something or someone I tend to listen to it and it calms me.,,
119,a,"How the words parallel how I feel right now. /I was making a playlist to listen to while writing my dissertation /It felt sad the way I was feeling /""Yes.",,,,,,,,,,,,,,,,,,,,,,,,,,,,,,,,I was making a playlist to listen to while writing my dissertation ,,,,,,,,,,,,,,,,,,,,,,,,,,,,,I was making a playlist to listen to while writing my dissertation ,,,,,,,,,,,,,How the words parallel how I feel right now./ It felt sad the way I was feeling ,,
119,b,"How much I like this song....""oooh I like this song:)"" \I like the song. It reminds me of happy parts of my childhood. My mom use to clean the house and listen to it. \I like the sound of the music. I like the tone of the song and the words. \Yes. It makes me think of happy times as a child.","How much I like this song....""oooh I like this song:)""/ \I like the song/ \I like the sound of the music. .",,,,,, I like the tone of the song and the words. ,,,,,,,,,,,,\I like the sound of the music. /  I like the tone of the song and the words. ,,,,,,,,,,,,,,,,,. It reminds me of happy parts of my childhood. / Yes. It makes me think of happy times as a child.,,,,,. It reminds me of happy parts of my childhood. / Yes. It makes me think of happy times as a child.,,,,,,, My mom use to clean the house and listen to it. ,,,,,,,,,,,,,,,,,,,,,,,,,,,,
